tweet_id,text,source,created_at,possibly_sensitive,author_id,places_type,places_normalized_text,hashtags,lang
1.4657445814426132e+18,"Amy Bolin said in order to be approved for a double-lung transplant, her husband had to be fully vaccinated for COVID even though he’d had the virus and recovered. After his second Moderna shot, he developed a pulmonary embolism and heart condition &amp; died

https://t.co/iMWtTtl95T",Twitter Web App,2021-11-30T18:08:35.000Z,0.0,1.4556456448199967e+18,Person,Amy Bolin,,en
1.465744563574911e+18,"The mainstream media says it is false that the COVID vaccine contains graphene oxide, last year's Chinese patent confirms graphene oxide in vaccines, as several doctors have said
https://t.co/7UJ0EIkyHn https://t.co/7cCfzZprNr",Twitter Web App,2021-11-30T18:08:30.000Z,0.0,9.777819478785966e+17,,,,en
1.46574454767002e+18,"Being that I’m on the latter end of the vaccine period, I’ve started wearing my mask again. I want covid to be over, but I also don’t want to go back to the way the world was before.",Twitter Web App,2021-11-30T18:08:27.000Z,0.0,1.428735977141543e+18,,,,en
1.4657445440461988e+18,The fact this it's really get a vaccine or lose your job is crazy to me,Twitter Web App,2021-11-30T18:08:26.000Z,0.0,109331331.0,,,,en
1.4657445392143032e+18,"Wonder why they won't release their covid vaccine test data for 55 fkn years? 

At the same time making more than enough to cover future fines.

Remember you boosters folks! 🤦‍♂️ https://t.co/SOlfZYycMp",Twitter for Android,2021-11-30T18:08:25.000Z,0.0,8.698649260761825e+17,,,,en
1.4657445319707935e+18,"Universal church and other religious institutes really telling their followers to stay away from vaccine. As adults these followers should know better but people are so religious they'll listen to whatever their pastor or priests says. They need to be stopped, people are dying.",Twitter for Android,2021-11-30T18:08:23.000Z,0.0,1393800902.0,,,,en
1.465744530196603e+18,BioNTech CEO says vaccine likely to protect against severe COVID from Omicron https://t.co/54zuni0CDH,Devdiscourse News Desk,2021-11-30T18:08:22.000Z,0.0,9.379626262224978e+17,Organization Place,BioNTech CEO Omicron,,en
1.46574452796518e+18,"In this polarized hour, citizens from both sides of the political spectrum are finding common cause in resisting COVID-19 vaccine mandates for children, with more than 100 grassroots groups in California joining forces in an effort called The Unity Project https://t.co/TnPRYS34r7",TweetDeck,2021-11-30T18:08:22.000Z,0.0,825966216.0,Place Organization,California The Unity Project,,en
1.4657445244798034e+18,‘Get Your Vaccine’: Pa. Gov. Wolf Says Urging COVID Shots Is His Containment Strategy https://t.co/E5hq5ikLdu,WordPress.com,2021-11-30T18:08:21.000Z,0.0,1.2837656886166282e+18,,,,en
1.4657445235779338e+18,"We must be nearing 3,000 plus cases since the beginning of October - could be more.. When does the #vaccine kick in?",Twitter Web App,2021-11-30T18:08:21.000Z,0.0,314098336.0,,,vaccine,en
1.4657445220512154e+18,‘Get Your Vaccine’: Pa. Gov. Wolf Says Urging COVID Shots Is His Containment Strategy https://t.co/gmqyFc4rED,WordPress.com,2021-11-30T18:08:20.000Z,0.0,1.2696128935294444e+18,,,,en
1.4657445185489633e+18,"so, where are we now...

well, the Vaccinated, those who rightly believed the #vaccine  would end this 18month enigma now find out that if they head off,upon return they will HAVE to produce a negative PCR, before entry

ah well

maybe, "" it's just for 3 weeks"" 
😉",Twitter for Android,2021-11-30T18:08:20.000Z,0.0,92087272.0,,,vaccine,en
1.4657445066833674e+18,We don't know much about Omicron but we do about jabs - they WORK #JabsArmy  https://t.co/oAsGVYgDTT,Echobox,2021-11-30T18:08:17.000Z,0.0,34655603.0,Person,Omicron,JabsArmy,en
1.4657445061630607e+18,"👇

RT @MalcontentmentT: The same people screaming ""my body, my choice,"" over a vaccine will be watching SCOTUS like a hawk as they hear arguments over the Mississippi abortion law, hoping a woman's right to choose is stripped away",TweetCaster for Android,2021-11-30T18:08:17.000Z,0.0,7598222.0,Organization Place,SCOTUS Mississippi,,en
1.4657445036507423e+18,"More than 2.48 billion (248 Crore) #COVID19 #vaccine doses adminstered in China, my Bharat 30.96% population fully vaccinated. Ie is (121.94 Cr) 
#boosterprik and Children #vaccine in pipe. 'How can we tackle with #OmicronVariant.'
#IPLAuction2022 
#tuesdayvibe 
#coronavirus https://t.co/TVoDjwelAa",Twitter for Android,2021-11-30T18:08:16.000Z,0.0,1.0417541872839352e+18,Place,China,COVID19 vaccine boosterprik vaccine OmicronVariant IPLAuction2022 tuesdayvibe coronavirus,en
1.465744496176599e+18,"Mastercard Foundation, Africa CDC deliver over 3 million vaccine doses to Nigeria https://t.co/xrRKM62Yqa",Premium Times Main,2021-11-30T18:08:14.000Z,0.0,373978904.0,Organization Place Place,Mastercard Foundation Africa Nigeria,,en
1.4657444914077164e+18,The dystopian feeling of sitting in a clinic waiting for a plague vaccine while Christmas music plays on the speaker and a mother wrestles her crying children. What reality are we even living in,Twitter for iPhone,2021-11-30T18:08:13.000Z,0.0,544864665.0,Other,Christmas,,en
1.4657444897424835e+18,CNBC host suggests nationwide vaccine mandate: 'Have the military run it' https://t.co/fF6eWqTiWo,Twitter Web App,2021-11-30T18:08:13.000Z,0.0,3012797347.0,Organization,CNBC,,en
1.4657444825910682e+18,Nursing unions around the world file U.N. complaint as debate over vaccine patent waivers stalls https://t.co/xZCjkb6m5C,dlvr.it,2021-11-30T18:08:11.000Z,0.0,44698675.0,Organization,U.N.,,en
1.4657444809806848e+18,No one needed nor should've had a vaccine for a nearly harmless virus. Making nothing into something to distract and perpetuate fear is a Democrat tactic.,Twitter Web App,2021-11-30T18:08:11.000Z,0.0,1.35304181421167e+18,Organization,Democrat,,en
1.4657444773945098e+18,Nursing unions around the world file U.N. complaint as debate over vaccine patent waivers stalls https://t.co/lHb20ghKmx,SocialFlow,2021-11-30T18:08:10.000Z,0.0,15008600.0,Organization,U.N.,,en
1.4657444716651233e+18,50+ &amp; over 5 months since your last vaccine - Irish pharmacists are offering the #booster shot. Ask them!,Twitter for Android,2021-11-30T18:08:08.000Z,0.0,4419831.0,,,booster,en
1.4657444695679836e+18,"Republican Dismisses Vaccine on Fox News, Praises It on CNN in Breathtaking Flip Flop https://t.co/xeixln0jgE via @Yahoo",Twitter Web App,2021-11-30T18:08:08.000Z,0.0,1.3033864007803617e+18,Organization Organization Organization,Republican Fox News CNN,,en
1.46574446819627e+18,"I got my booster, did U? Covid live: boosters may protect against Omicron, says Israel’s health minister, as US checks vaccine effectiveness https://t.co/1AaMOfHH5s",Twitter Web App,2021-11-30T18:08:08.000Z,0.0,8.038100594907095e+17,Organization Place Place,Omicron Israel US,,en
1.4657444679699456e+18,"This is not a vaccine...and you all need to watch this. Many of you who follow me know this already. 

https://t.co/wXNmrO3JRq",Twitter Web App,2021-11-30T18:08:08.000Z,0.0,1.3291992451534643e+18,,,,en
1.4657444587759903e+18,"Crypto, Pandemic, Metaverse, masks, stocks, vaccine, health, sex trafficking, Epstein , billionaires 🤫 🤐",Twitter for iPhone,2021-11-30T18:08:05.000Z,0.0,107736362.0,Person,Epstein,,en
1.4657444360512512e+18,"Biontech-CEO Ugur Sahin is confindent that the company's vaccine will protect people infected with #Omicron  from severe illness. “Our message is: Don’t freak out, the plan remains the same: Speed up the administration of a third booster shot"". #Omikron 
https://t.co/XeFEtfM4b2",Twitter Web App,2021-11-30T18:08:00.000Z,0.0,7.22150836495913e+17,Person,Biontech-CEO Ugur Sahin,Omicron Omikron,en
1.4657444293907333e+18,"It's fucking incredible how people still don't understand how the vaccine works. You're either stupid as fuck, or you're actively trying to misrepresent it to push your narrative.",Twitter for Android,2021-11-30T18:07:58.000Z,0.0,2564142475.0,,,,en
1.465744428488749e+18,Will the #Moderna #OmicronVariant  Booster Push The Stock to $500? Technical Analysis &amp; Price Prediction!! 🚀 (2/3 ) Full video on Youtube: investwithjo #mrna #mrnastock #modernastock #stock #vaccine #invest #finance #technicalanalysis #daytrading #stockmarket #robinhood #crypto https://t.co/k3b11PDjOm,Twitter Web App,2021-11-30T18:07:58.000Z,0.0,1.3933980210191688e+18,Organization,Youtube,Moderna OmicronVariant mrna mrnastock modernastock stock vaccine invest finance technicalanalysis daytrading stockmarket robinhood crypto,en
1.4657444144212296e+18,Opinion | Red states are now paying people not to get vaccinated https://t.co/lAiIjT9xAW,Twitter Web App,2021-11-30T18:07:55.000Z,0.0,577333209.0,,,,en
1.4657444141569884e+18,I cornfused. Somebody told all those unvaccinated ppl who proposing to go take a vaccine??? Was a mandate made??? What are they protesting? 😩😩😩,Twitter for iPhone,2021-11-30T18:07:55.000Z,0.0,9.188837290278461e+17,,,,en
1.4657443868016845e+18,American businesses slow walking Biden's vaccine mandates as courts lay waste to it. Canada next? Couldn't happen soon enough for the sake of our economy? #cdnpoli @fordnation @YellowVestsCA @dockaurG  https://t.co/QQBi0FPsF6,Twitter Web App,2021-11-30T18:07:48.000Z,0.0,8.925899088119726e+17,Person Place,Biden Canada,cdnpoli,en
1.465744369420419e+18,"Los Angeles Begins Enforcing Vaccine Mandate at Gyms, Restaurants, Businesses HOMICIDE VICTIMS FAMILIES ARE SUFFERING IN LOS ANGELES  https://t.co/bRLOeyuVlt",Twitter for iPhone,2021-11-30T18:07:44.000Z,0.0,1.3193099529141248e+18,Place Place,Los Angeles LOS ANGELES,,en
1.465744355986006e+18,"I know it's selfish, but I'm not looking to a fourth (fifth?) wave of COVID *news.* 

More months of transmission rates, cases, deaths, hospitalization rates, ICU availability, vaccine efficacy, vaccine recommendations, vaccine development, protein spikes...

GET VACCINATED!!!!!!",Twitter Web App,2021-11-30T18:07:41.000Z,0.0,35164331.0,,,,en
1.4657443439107318e+18,"CBSA has intercepted hundreds of fake COVID-19 tests, vaccine documents https://t.co/LO8580FlZh",Twitter for iPad,2021-11-30T18:07:38.000Z,1.0,57392611.0,,,,en
1.465744336281346e+18,Got my third vaccine/booster today. I didn't even feel the needle for the 2nd shot but I definitely felt it today. Seems like Covid's about to get a lot worse but hopefully this will help. #Vaccinated #Booster #Covid19,Twitter Web App,2021-11-30T18:07:36.000Z,0.0,1.0966279289793946e+18,Person,Covid,Vaccinated Booster Covid19,en
1.4657443225785958e+18,"The #OmicronVariant is cause for concern but not panic. The best way to protect yourself and others is to get the #COVID19 vaccine if you have not done so yet, or get the booster if you are eligible to receive it!

https://t.co/UKssiEQHrR",Twitter Web App,2021-11-30T18:07:33.000Z,0.0,1074129612.0,,,OmicronVariant COVID19,en
1.465744321206911e+18,Will the #Moderna #OmicronVariant  Booster Push The Stock to $500? Technical Analysis &amp; Price Prediction!! 🚀 (3/3 ) Full video on Youtube: investwithjo #mrna #mrnastock #modernastock #stock #vaccine #invest #finance #technicalanalysis #daytrading #stockmarket #robinhood #crypto https://t.co/lIyzo1v17d,Twitter Web App,2021-11-30T18:07:33.000Z,0.0,1.3933980210191688e+18,Organization,Youtube,Moderna OmicronVariant mrna mrnastock modernastock stock vaccine invest finance technicalanalysis daytrading stockmarket robinhood crypto,en
1.465744305516077e+18,"In an effort to show how safe vaccines are, you clearly have to post details of people who've died despite having the vaccine

The reality of Covid is: Overall figures
Population 7.9 Billion
Died from Covid 0.00521 Billion https://t.co/TNtpjUommq",Twitter Web App,2021-11-30T18:07:29.000Z,0.0,9.971374506350551e+17,,,,en
1.4657442949632614e+18,"If you think #Vaccine is about #COVID19 think again it’s about a #SatanicCabal denying GOD’s Authority to #enslave Humanity #Depopulate

Mel K &amp; Pharma Analyst &amp; Whistleblower Karen Kingston On Terrifying AI &amp; Rogue Science 11-27-21 https://t.co/9O9wCl2VpE via @BitChute",Twitter Web App,2021-11-30T18:07:26.000Z,0.0,1.2569619692545352e+18,Other Person Person,GOD Mel K Karen Kingston,Vaccine COVID19 SatanicCabal enslave Depopulate,en
1.465744292585132e+18,Strange. It’s your body your choice when it comes to killing a baby inside you but support mandates on injecting foreign substance in your body . So it’s not your body your choice on the vaccine,Twitter for iPhone,2021-11-30T18:07:26.000Z,0.0,1.3815565831890862e+18,,,,en
1.465744291125416e+18,"South Carolina's biggest colleges, including @uofsc and @ClemsonUniv, have told some employees they must comply with the Biden Administration's federal vaccine mandate, per @jmholdman  https://t.co/llugRIcmu3",Twitter Web App,2021-11-30T18:07:25.000Z,0.0,781725127.0,Place Organization,South Carolina Biden Administration,,en
1.4657442836092723e+18,"Vegan dies of Covid-19 after refusing vaccine over animal testing ""'The last thing Glynn (Steel) said to me was ‘I have never felt so ill, I wish that I had the vaccine’"" Are any vaccine refusers and pandemic deniers listening this time?   https://t.co/nCsC1ENT0G",Twitter Web App,2021-11-30T18:07:24.000Z,0.0,39318996.0,Place,Glynn,,en
1.4657442811850138e+18,"SC officials raised concerns about this vaccine sign-up system, but DHEC still chose to use it. Why? https://t.co/QcA9MRfH60 @scdhec VAMS was the worst system ever!  I had difficulty navigating it and I’m pretty computer literate and have a masters degree.",Twitter for iPhone,2021-11-30T18:07:23.000Z,0.0,2904015492.0,Organization,SC,,en
1.4657442732913295e+18,I already don’t wanna take this vaccine and they taking all day. Imma fuck around and dip on they ass.,Twitter Web App,2021-11-30T18:07:21.000Z,0.0,1173331531.0,,,,en
1.4657442720204513e+18,"I suppose this new variant shows that if the First World doesn't ensure the Third World gets vaccines, it doesn't matter how many jabs and boosters we have, we will still be at risk, and restricted, by variants from overseas. We need to ramp up vaccine supplies worldwide.",Twitter for Android,2021-11-30T18:07:21.000Z,0.0,344761514.0,,,,en
1.4657442714037944e+18,"I want this pandemic over with, even if it can be done by the smallest margin possible. If that means taking a vaccine and some booster shots, then I’ll do that.",Twitter for iPhone,2021-11-30T18:07:21.000Z,0.0,1365899269.0,,,,en
1.4657442616353137e+18,"Vaccine makers split on protection against #Omicron variant 

“#Oxford and #BioNTech predict existing jabs will prevent severe disease, striking more upbeat tone than #Moderna”

https://t.co/JGiZ9F8ijK",Twitter for iPhone,2021-11-30T18:07:18.000Z,0.0,861144656.0,,,Omicron Oxford BioNTech Moderna,en
1.4657442498157732e+18,"Dr. Andreas Noack - Recently deceased, explains the Graphene component in the vaccine (RIP) https://t.co/0dTerSFgGK via @BitChute",Twitter Web App,2021-11-30T18:07:16.000Z,0.0,1.315306799579439e+18,Person,Dr. Andreas Noack,,en
1.4657442491361567e+18,".@moderna_tx CEO sounds quite pessimistic about vaccine effectiveness against Omicron (or maybe he's setting low expectations). But while they'll likely take a hit, mRNA vaccines should still provide substantial protection on an individual level.

https://t.co/Batn25Qusk",Twitter Web App,2021-11-30T18:07:15.000Z,0.0,25734884.0,Organization,Omicron,,en
1.4657442423122043e+18,"Excited to share my first story working as a contributing Data Reporter for @WBEZ , @BrownInstitute and @MuckRock 

As part of the story, we analyzed thousands of vaccine shipment records FOIA'd from the Chicago Department of Public health. 

https://t.co/qw2wBIiRpu",Twitter Web App,2021-11-30T18:07:14.000Z,0.0,899258376.0,Organization Organization,FOIA Chicago Department of Public,,en
1.4657442392126013e+18,i would like to hear less about how omicron has affected stocks since its discovery and more about what the plan is for making sure everyone across the globe has access to a vaccine during an almost two-year-long global health crisis... if there even is one,Twitter Web App,2021-11-30T18:07:13.000Z,0.0,1.0699887362876006e+18,,,,en
1.4657442293643756e+18,"Got a text from NHS Scotland that I could book a booster vaccine, so it’s booked for next week!",Twitter for iPad,2021-11-30T18:07:11.000Z,0.0,7.826664424077189e+17,Organization,NHS Scotland,,en
1.4657442260088955e+18,"Happy #Coronadvent!

-------
#Corona #coronavirus #Advent #Adventsfest #Adventskalender #AdventCalendar #Adventszeit #adventure #Christmas #Christmas2021 #Omikron #Omicron #Delta #DeltaVariant #Impfpflicht #impfpflichtjetzt #ImpfenSchuetzt #Booster #BoosterShots #vaccine https://t.co/YJjbtDyZ9g",Twitter for Android,2021-11-30T18:07:10.000Z,0.0,1.3746849198892892e+18,,,Coronadvent Corona coronavirus Advent Adventsfest Adventskalender AdventCalendar Adventszeit adventure Christmas Christmas2021 Omikron Omicron Delta DeltaVariant Impfpflicht impfpflichtjetzt ImpfenSchuetzt Booster BoosterShots vaccine,en
1.4657442093532078e+18,The Moderna CEO says existing COVID-19 vaccines will likely be less effective against the new Omicron variant. https://t.co/sr5HGzM2Un,Zuitte Apps,2021-11-30T18:07:06.000Z,0.0,2576399175.0,Organization,Moderna CEO,,en
1.465744205859496e+18,"Vaccine deniers are a scourge on the planet…

Congress should form a committee to investigate these people.

Subpoenas them &amp; ask them to explain their ‘facts’ while under oath.

Fact check real time.

Great Reality TV potential… as well as exposing these frauds &amp; hucksters.",Twitter for iPhone,2021-11-30T18:07:05.000Z,0.0,8.749843869822853e+17,,,,en
1.4657442054398566e+18,Rich countries must stop blocking the COVID vaccine patent waiver https://t.co/XleEB9lMtN,Twitter for Android,2021-11-30T18:07:05.000Z,0.0,1.0665814365246792e+18,,,,en
1.465744200809472e+18,"Gr8 retired NHS Doc just makes2much sense+interviewer wants him 2b pro-mandate+lockdowns
{b4 we have ANY data on omicron}.
I like that he says the opposite, even mocks a healthcare person's comment:
""looks like new variant can evade the vaccine...so, go get your booster""

huh?!🤦‍♂️ https://t.co/6F5Qb3TZKR",Twitter for iPhone,2021-11-30T18:07:04.000Z,0.0,125787999.0,Organization,NHS,,en
1.4657441921524285e+18,"Personal health care decisions should be up to individual Americans in consultation with their doctor, not coerced by the federal government.

This is why @Heritage is suing the Biden Administration over the vaccine mandate.
https://t.co/qgcSbWHt8x",Sprout Social,2021-11-30T18:07:02.000Z,0.0,130600206.0,Organization,Biden Administration,,en
1.4657441696080937e+18,Bumbling boris marches on ffs what a c##t  “vaccine centres popping up like Christmas trees”😱,Twitter for iPhone,2021-11-30T18:06:56.000Z,0.0,3124004621.0,Other,Christmas,t,en
1.465744165074051e+18,".@Timcast Here, I did the work for you again.
Apparently microchipping, is something many citizens in Sweden have been doing for a variety of reasons and now, includes covid vaccine info.
This is also voluntary and not for Covid passports.
https://t.co/xbMNuysHe6 https://t.co/TYYdyEuyp3 https://t.co/2XsbbWwbCz",Twitter Web App,2021-11-30T18:06:55.000Z,0.0,1.3842270595730022e+18,Place,Sweden,,en
1.4657441582918124e+18,I still dont understand more deaths post vaccine/treatments. Can someone explain it to me like I am not an epidemiologist and I am 5?,Twitter Web App,2021-11-30T18:06:54.000Z,0.0,8.604751199065006e+17,,,,en
1.4657441575075635e+18,"In this polarized hour, citizens from both sides of the political spectrum are finding common cause in resisting COVID-19 vaccine mandates for children, with more than 100 grassroots groups in California joining forces in an effort called The Unity Project https://t.co/UjZ5yN9pTN",TweetDeck,2021-11-30T18:06:54.000Z,0.0,268375933.0,Place Organization,California The Unity Project,,en
1.4657441453818266e+18,Why would any top executive speculate that his companies product may not work and cause their stock to fall?  Please fire him!  Stocks sink after vaccine maker expresses Omicron concerns - CBS News https://t.co/SWhuycIeqE,Twitter for iPhone,2021-11-30T18:06:51.000Z,0.0,2732853796.0,Organization Organization,Omicron CBS News,,en
1.4657441412461527e+18,"Wasn’t every single player other than 4 individuals vaccinated at the start of the season? Didn’t they “get the vaccine so they could go back to normal” 

🤨🤯 https://t.co/0oKAlQkqZp",Twitter for iPhone,2021-11-30T18:06:50.000Z,0.0,985951405.0,,,,en
1.465744137618133e+18,"EU could approve shot against Omicron in 3-4 months https://t.co/hDIotOo3br via @YouTube

So after you’re fully vaccinated, and boosted, go and get your new vaccine. Probably need 3 of those as well, maybe 4. You only need to be reborn once. Save your soul. Walk in the light.",Twitter for iPhone,2021-11-30T18:06:49.000Z,0.0,1.3443423986383708e+18,,,,en
1.4657441370182984e+18,"CBSA has intercepted hundreds of fake COVID-19 tests, vaccine documents https://t.co/WGwIEEOHpY",WordPress.com,2021-11-30T18:06:49.000Z,0.0,1.3936137472440484e+18,,,,en
1.465744134258393e+18,"Vaccine in my body?  No!  Gov't interference.  A woman's right to choose, well, hell yeah, the government has a right to intervene.  Double standard anyone??

What ‘My Body, My Choice’ Means to the Right https://t.co/DTcPE1e0XR",Twitter Web App,2021-11-30T18:06:48.000Z,0.0,2191332168.0,,,,en
1.4657441308401746e+18,i shouldn’t have to fight this hard to keep my job because of the vaccine mandate.,Twitter for iPhone,2021-11-30T18:06:47.000Z,0.0,2350546381.0,,,,en
1.4657441196664054e+18,"I found this on NewsBreak – the #1 local news app used by 45+ million people: Vaccine mandates multiply across California 
https://t.co/UC3LQbl5YO",Twitter for Android,2021-11-30T18:06:44.000Z,0.0,617504807.0,Place,California,,en
1.4657441185088348e+18,Tomorrow I going for my 3rd jab of the Sinophan VACCINE.,Twitter for Android,2021-11-30T18:06:44.000Z,0.0,636519995.0,Other,Sinophan VACCINE,,en
1.4657441168101908e+18,Tuesday” #fundraiser!! They have falsely labeled us for hate speech and #vaccine misinformation. We want everyone to still donate but we will be using PayPal! All funds should be sent to Israel@Israelunite•org and label funds “Takeover Tuesday” thank you ! https://t.co/TPLx81KPfT,Twitter for iPhone,2021-11-30T18:06:44.000Z,0.0,9.881752399589458e+17,Product Place,PayPal Israel,fundraiser vaccine,en
1.4657441138742272e+18,"I have spent the last 4 months interviewing 3 times with a company.  

Vaccination was not mentioned until now.

I have made it this far because of my values and personality, and I've received an offer contingent on receiving the COVID-19 'vaccine.' https://t.co/i1Ew5HOrjk",Twitter Web App,2021-11-30T18:06:43.000Z,0.0,1.4657336187819008e+18,,,,en
1.4657441131778703e+18,While posting your video about the vaccine or the virus itself please post your doctorate or degree in medicine,Twitter for iPhone,2021-11-30T18:06:43.000Z,0.0,561951320.0,,,,en
1.4657440946432942e+18,"CDC strengthened its guidance on boosters Monday, saying all adults should get booster shots six months after finishing the first two doses of Moderna's or Pfizer/BioNTech's vaccine and two months after getting Johnson &amp; Johnson's single-dose vaccine. #tnceal @pdjuarez #ncmedrcop",Twitter for iPhone,2021-11-30T18:06:39.000Z,0.0,1.3461588730031268e+18,Organization Organization Organization Person Person,CDC Moderna Pfizer Johnson Johnson,tnceal ncmedrcop,en
1.465744063349629e+18,"Mara the Vaccine Mandates will keep more unemployment yet you are silent @Julius_S_Malema...

How much is @EmbassyofRussia paying you... https://t.co/A8wqqYdpBP",Twitter for Android,2021-11-30T18:06:31.000Z,0.0,1.197122241261187e+18,,,,en
1.4657440629006295e+18,"YouTube Cracks Down On Anti-Vaccine Misinformation, Ejects Robert Kennedy Jr. And Others From Platform – Deadline https://t.co/f9Cuf9e4aL",Twitter for Android,2021-11-30T18:06:31.000Z,0.0,1.4509728413194363e+18,Organization Person,YouTube Robert Kennedy Jr.,,en
1.465744054768001e+18,"More people will become eligible for the COVID-19 booster vaccine over the coming weeks. ⬇️

➡️ If you aren’t already eligible for a booster jab, please do not contact the NHS.

➡️ You will be contacted when it's your turn to receive the COVID-19 booster.

https://t.co/rJxqWoWCpQ",Zapier.com,2021-11-30T18:06:29.000Z,0.0,1.2604887649227612e+18,,,,en
1.465744054394753e+18,"Jab’s Army? I’ve heard it all now! Everyone get your boosters, because three vaccines that don’t work are better than two! 🤣 #youcouldntmakeitup #booster #covid #vaccine #BorisJohnson #ToryCovidCatastrophe https://t.co/DZFVKkWZKt",Twitter for iPhone,2021-11-30T18:06:29.000Z,0.0,1.4598667179041546e+18,,,youcouldntmakeitup booster covid vaccine BorisJohnson ToryCovidCatastrophe,en
1.4657440505318031e+18,"To see if you're currently eligible to receive the COVID-19 booster, visit our page ⬇️

https://t.co/hFjYvEQ9nk",Zapier.com,2021-11-30T18:06:28.000Z,0.0,1.2604887649227612e+18,,,,en
1.465744044101886e+18,"Maybe it’s time for the WH to start daily COVID briefings. Because if the Delta Variant is allowed to mutate unchecked, it may become a vaccine-proof strain. Then we’re back to square one, lockdowns, and a new vaccine for 300M people.03",The Social Jukebox,2021-11-30T18:06:26.000Z,0.0,289118612.0,Organization,Delta Variant,,en
1.465744034828329e+18,"Moderna chief warns: We expect a ""material drop"" in vaccine effectiveness against Omicron https://t.co/5YpjMjSKSq",Twitter Web App,2021-11-30T18:06:24.000Z,0.0,7.035880356576461e+17,,,,en
