tweet_id,text,source,created_at,possibly_sensitive,author_id,places_type,places_normalized_text,hashtags,lang
1.4657470593073398e+18,"Upstate NY Counties declare state of emergency rising hospitalizations with Covid.  Optional surgeries have been canceled.   Mostly unvaccinated non-believers, that have run for the hills scared shitless rejecting vaccine.  @The_Real_Feisty",Twitter for iPhone,2021-11-30T18:18:25.000Z,0.0,472221936.0,Place Place,Upstate NY Covid,,en
1.4657470475717222e+18,LoL be then they all pass out from the vaccine Hahahaha https://t.co/JdM3HAtbiw,Twitter Web App,2021-11-30T18:18:23.000Z,0.0,1.4465882682466714e+18,,,,en
1.4657470474624942e+18,"“The best protection against this new variant — or any of the variants out there, the ones we’ve been dealing with already — is getting fully vaccinated and getting a booster shot.” https://t.co/0UVOdDd4hx",Twitter Web App,2021-11-30T18:18:23.000Z,0.0,41169716.0,,,,en
1.465747043096445e+18,I’m not taking health advice from someone who don’t got a legit reason for not getting the vaccine. I think I got a better understanding of this than you. Keep pushing that conspiracy agenda tho bro 🙏🏽 https://t.co/UHE6u4qMMc,Twitter for iPhone,2021-11-30T18:18:21.000Z,0.0,7.558789942228664e+17,,,,en
1.4657470286134764e+18,An Impolite Message to Those Who Got the Covid “Vaccine” – LewRockwell https://t.co/PtNOH4pxNS https://t.co/hxZxA5n9m9,WordPress.com,2021-11-30T18:18:18.000Z,1.0,41159844.0,,,,en
1.4657470109763215e+18,"Sad day in history 

PROOF  OUR GOVERNMENT MEANS TO HARM US 

Craig Kelly moved to place amendments to the National health act that prevents  the Government from forcing or coercing a person to inject a vaccine for the purposes of job ...#auspol 

https://t.co/cxgWh6cR5z https://t.co/prba2rusR2",Twitter for iPad,2021-11-30T18:18:14.000Z,0.0,1.4114716511626527e+18,Person,Craig Kelly,auspol,en
1.4657470094832968e+18,"PM tells Downing Street press conference temporary vaccine centres will be ‘popping up like Christmas trees’

Tired, oh so tired.",Twitter for Android,2021-11-30T18:18:13.000Z,0.0,2972983919.0,Organization Other,Downing Street Christmas,,en
1.46574700291917e+18,"Covid booster jabs - when can each age group expect to get their vaccine?

We hear from the head of the vaccination programme Dr Patricia Donnelly.

And the 9 year old girl who has been the Lord Mayor of Belfast for the day.

Join me for @bbcnewsline at 6.30",Twitter Web App,2021-11-30T18:18:12.000Z,0.0,485844797.0,Person Other,Dr Patricia Donnelly Lord Mayor of Belfast,,en
1.465746994106749e+18,"(RNS) —  Marcus Lamb, a prominent Christian broadcaster known for his outspoken opposition to COVID-19 vaccines, has died after contracting the virus.

Marcus Lamb, anti-COVID vaccine Christian broadcaster, dies at 64 https://t.co/YQEPvSwo6h via @RNS",Twitter for iPad,2021-11-30T18:18:10.000Z,0.0,1329685254.0,Person Person,Marcus Lamb Marcus Lamb,,en
1.4657469794981192e+18,The so called Aspenovax which i think will be alocal vaccine  will be sold in south africa ...HHE BANA..why the other one is free ?,Twitter for Android,2021-11-30T18:18:06.000Z,0.0,1.3977744473236316e+18,Person Place,Aspenovax south africa,,en
1.4657469723550884e+18,"Seems like none of us know for sure whether Moderna Chief is right about vaccine efficacy ), but I think it’s dangerous and irresponsible to ascribe financial motivations to these companies w/o evidence. https://t.co/gFjDxBScF8",TweetDeck,2021-11-30T18:18:05.000Z,0.0,21429882.0,Organization,Moderna Chief,,en
1.4657469670159647e+18,"As I have warned, chips implantats are next. I am fluent in Swedish, I understand everything he says. https://t.co/zN81UjfvX9",Twitter for iPhone,2021-11-30T18:18:03.000Z,1.0,1.2654819578630513e+18,,,,en
1.4657469633919918e+18,“One for all and all for one” should be the mantra for the vaccine 💉 https://t.co/llaP1fvjoz,Twitter for iPhone,2021-11-30T18:18:02.000Z,0.0,27875201.0,,,,en
1.465746959130579e+18,"Stocks sink after vaccine maker expresses Omicron concerns #financialliteracy #personalfinance #financialfreedom 
#debtmanagement #debtfree #debtmanagement #finance  
- Focus your Debtview -
- Read the Full Story Here - https://t.co/WweSIBOjZC",SocialBee.io v2,2021-11-30T18:18:01.000Z,0.0,46382479.0,Organization,Omicron,financialliteracy personalfinance financialfreedom debtmanagement debtfree debtmanagement finance,en
1.465746930542256e+18,This is just ridiculous behavior!  Family harassed in North Bay while taking their 7 year old for his first vaccine shot..  https://t.co/WKRZFh4weB,Twitter for iPhone,2021-11-30T18:17:55.000Z,0.0,4012981643.0,Place,North Bay,,en
1.465746928650662e+18,"This mans whining cause he didn’t get asked for his vaxx pass 🤭😂😂😂 guess he doesn’t believe his vaccine works for him, never thought ppl could be so stupid! 😂😂😂😂 just stay home dude, that plane could crash and your risking that 😂 but scared of a virus with 99.8% survival https://t.co/JoIwa76YvP",Twitter for iPhone,2021-11-30T18:17:54.000Z,0.0,1.4342295188946166e+18,,,,en
1.4657469023985132e+18,"Forbes changes headline from ""Yes, the vaccine changes your DNA...a Tiny Bit. That's a Good Thing."" 

To ""COVID vaccines don't alter your DNA."" https://t.co/vIUnCY7NML",Twitter Web App,2021-11-30T18:17:48.000Z,0.0,1.1704696837006213e+18,Organization,Forbes,,en
1.4657468995631268e+18,And if they can't pay or won't pay will Greece start locking up their pensioners? The world has truly lost the plot. 😟#Covid #vaccine https://t.co/oGZQK9rfIL,Twitter Web App,2021-11-30T18:17:47.000Z,0.0,9.713158173580206e+17,Place,Greece,Covid vaccine,en
1.4657468796485714e+18,"FOR EVERY ARM INJECTED WITH THIS NEW VACCINE INNOVATION, YOU SEE AN INCREMENTAL RISE IN ITS SHARE VALUE. IT MUST BE SAID VALUE INCREASES IF THE HUMAN SUBJECTS DON`T DIE OR SUFFER INJURY. THE VACCINE ROLL OUT IS A TRIAL ON DISPOSABLE SUBJECTS.",Twitter Web App,2021-11-30T18:17:43.000Z,0.0,1.289290857355649e+18,,,,en
1.4657468793885573e+18,"Mastercard Foundation, Africa CDC deliver over 3 million vaccine doses to Nigeria https://t.co/msDaA8vgp3",WordPress.com,2021-11-30T18:17:42.000Z,0.0,1.2826157786640015e+18,Organization Place Place,Mastercard Foundation Africa Nigeria,,en
1.4657468716332524e+18,My observation is that our government is providing best healthcare for a population. Individuals opposed to vaccine mandates are more interested in personal rights. What each individual fears most determines their choice. https://t.co/j3InwAwdyp,Twitter for iPhone,2021-11-30T18:17:41.000Z,0.0,1.2353651435523277e+18,,,,en
1.4657468647082844e+18,"BIDEN BLINKED!  It’s over!
#BidenBlinked
#DoNotComplyEVER 
#HoldTheLine
#MandatesAreNotLaws
@catturd2 
Biden administration won't take action against unvaccinated federal workers until next year https://t.co/aIw3afJXo6 via @nbcnews",Twitter for iPad,2021-11-30T18:17:39.000Z,0.0,1.341098846336643e+18,Person Person,BIDEN Biden,BidenBlinked DoNotComplyEVER HoldTheLine MandatesAreNotLaws,en
1.4657468426547528e+18,#RwOT: Prioritisation of the health of Rwandans at its best -  https://t.co/8jrq5tZMZx,Twitter for Android,2021-11-30T18:17:34.000Z,0.0,303823057.0,,,RwOT,en
1.465746807095378e+18,Defense secretary warns Oklahoma's GOP governor that troops who don't get COVID-19 vaccine are putting their careers in jeopardy https://t.co/c7TA7xLbUh resounding voice of reason/my Dr voiced his great surprise at 'modern day troops' balking at vaccinations just yesterday...,Twitter Web App,2021-11-30T18:17:25.000Z,0.0,1.2562840293655675e+18,Place Organization Person,Oklahoma GOP Dr,,en
1.465746805056938e+18,"We're monitoring the #OmicronVariant &amp; waiting on more information that should come in the next few weeks in regard to infectivity, severity of illness &amp; vaccine effectiveness. Regardless of new variants, getting your initial vaccine &amp; boosters when eligible will help [1/3] https://t.co/6CI0N6FnMu",Twitter Web App,2021-11-30T18:17:25.000Z,0.0,33548996.0,,,OmicronVariant,en
1.4657467886866432e+18,The life and tragic death of John Eyers – a fitness fanatic who refused the vaccine #Fitness #ux via https://t.co/9UiYqby29m https://t.co/PRsJmYwWNg,TwinyBots,2021-11-30T18:17:21.000Z,0.0,1.161474396160217e+18,Person,John Eyers,Fitness ux,en
1.465746769929724e+18,EU medical agency says vaccine revisions for omicron could be approved in 3-4 months... https://t.co/sIo4TsgZQ5,AutoPostingFromHealthCare,2021-11-30T18:17:16.000Z,0.0,1.0176101771415265e+18,Organization,EU,,en
1.4657467663602442e+18,The life and tragic death of John Eyers – a fitness fanatic who refused the vaccine https://t.co/nadUZQWQRX,Twitter Web App,2021-11-30T18:17:16.000Z,0.0,9.225569811471401e+17,Person,John Eyers,,en
1.4657467662723727e+18,"I believe that the state of Iowa should NOT enforce a mask mandate at schools. At the current state with 69% of Iowans having the vaccine, I do not see a reason why there should be a mask mandate. It could be beneficial, but there’s too much backlash that would come w/ a mandate.",Twitter for iPhone,2021-11-30T18:17:15.000Z,0.0,1.4657457535953306e+18,Place,Iowa,,en
1.4657467602074173e+18,Another one bites the dust.  How many more will die before these fools wake up? https://t.co/9rGFXn8aIl,Twitter for iPhone,2021-11-30T18:17:14.000Z,0.0,1.43928994079019e+18,,,,en
1.4657467509672755e+18,"Breakthrough COVID-19 infections more severe, likely in immunocompromised individuals: Pfizer study https://t.co/CEFTlcaCQD Wonder how many of these individuals would have not gotten the vaccine knowing this ahead of time. 🤦‍♂️",Twitter for iPhone,2021-11-30T18:17:12.000Z,0.0,1.226535968171266e+18,,,,en
1.4657467462233866e+18,"Movie Theaters Can Attract More Customers With Vaccine Mandates, Lower Ticket Prices, Study Finds https://t.co/SQt86pRy1N via @variety",Twitter Web App,2021-11-30T18:17:11.000Z,0.0,8.987920800461455e+17,,,,en
1.4657467422975631e+18,y’all keep arguing about vaccinated vs. unvaccinated individuals while like half the globe doesn’t even have access to the vaccine bc a handful of countries are hoarding it,Twitter for iPhone,2021-11-30T18:17:10.000Z,0.0,2722422934.0,,,,en
1.4657467363835494e+18,Hahahaha. I take solace in knowing this fruitcake took the vaccine. https://t.co/WBsXCwaj7n,Twitter Web App,2021-11-30T18:17:08.000Z,0.0,120592197.0,,,,en
1.4657467222447718e+18,"The older generations are really comparing the vaccine to Apartheid, are they sniffing lead to be this jas. 
Did they think Apartheid was a choice. You're oumas and oupas are on some other kak.",Twitter for Android,2021-11-30T18:17:05.000Z,0.0,906675078.0,Person,Apartheid,,en
1.465746721921712e+18,Pediatric group pushing for kids to get vaccine for Sars-cov-2?  What? This group clearly cannot do the math. But the shame is that children will be injured and some will die from the experimental mRNA injections. These Doctors are complicit with the mayhem and loss that results https://t.co/AUFuPKPoGn,Twitter Web App,2021-11-30T18:17:05.000Z,0.0,43803669.0,,,,en
1.465746716976681e+18,Calgary Doctor's Office Raided By Regulators Searching For Vaccine Exemption Files https://t.co/i8W45HyfFo,Twitter for iPhone,2021-11-30T18:17:04.000Z,0.0,2786334515.0,Place,Calgary,,en
1.465746687847125e+18,Today is The Day! They’ve falsely labeled us for hate speech and #vaccine misinformation. We want everyone to still donate but we will be using PAYPAL! All funds should be sent to Israel@israelunite•org and label funds “Takeover Tuesday” thank you so much for your participation! https://t.co/3WF4jT87RF,Twitter for iPhone,2021-11-30T18:16:57.000Z,0.0,8.13555225722114e+17,Product Place,PAYPAL Israel,vaccine,en
1.465746684206588e+18,Pfizer could have a new vaccine against omicron Covid variant in less th... https://t.co/jtQx6zkiT6 via @YouTube,Twitter Web App,2021-11-30T18:16:56.000Z,0.0,1.0240730822590792e+18,Organization,Pfizer,,en
1.4657466631510467e+18,Deleting my vaccine tweet . All you Kyrie clones are stupid,Twitter for iPhone,2021-11-30T18:16:51.000Z,0.0,25947564.0,Person,Kyrie,,en
1.4657466625261773e+18,Stephanie Gard: 3rd Equestrian Athlete Severely Injured After Receiving Pfizer COVID Vaccine https://t.co/zkVRFR4W4J,Twitter Web App,2021-11-30T18:16:51.000Z,0.0,94112255.0,Person,Stephanie Gard,,en
1.4657466463068529e+18,Iam one of them 5 million people. I don’t listen to the news. That is the real enemy. I will never take the vaccine. There Agenda will be no more https://t.co/OZPAFHUNYk,Twitter for iPhone,2021-11-30T18:16:47.000Z,0.0,1.3663576412666634e+18,,,,en
1.4657466240015933e+18,So a prosperity gospel peddler who bought a private jet with tithes from vulnerable viewers and used his massive platform to spread every manner of vaccine disinformation died from covid? Guess he didn’t have enough faith. Shoulda prayed more. https://t.co/qKwP1lXxf4,Twitter for iPhone,2021-11-30T18:16:42.000Z,0.0,366911654.0,,,,en
1.465746616506368e+18,Pope Francis says Covid vaccine will now be required to enter Heaven https://t.co/MTGH0hgmpL #Covid #Covid19 #Coronavirus #Pandemic #Virus,Twitter Web App,2021-11-30T18:16:40.000Z,0.0,1.4387810501640274e+18,Person Person,Pope Francis Covid,Covid Covid19 Coronavirus Pandemic Virus,en
1.4657466055214817e+18,"2021-11-30 As of Nov 29 Nova Scotia administered 1,635,675 doses of COVID-19 vaccine. 
* 844,933 first doses (86.3% of population)
* 790,742 second doses (80.7% of population)
* 20,858 third doses
Nova Scotia Vaccine Program:
https://t.co/rKZ7MS8tgH https://t.co/dwNAId2deG",Twitter Web App,2021-11-30T18:16:37.000Z,0.0,2993727444.0,,,,en
1.4657466053956485e+18,"Worldwide Vaccine Failure

This is not how it was supposed to go.

https://t.co/O3VNOToiRd https://t.co/LpQP1BCAVP",Twitter for Android,2021-11-30T18:16:37.000Z,0.0,1090205748.0,,,,en
1.465746602337964e+18,"""If we had full information on the effectiveness of each vaccine &amp;we freely allowed manufacturers everywhere to produce any vaccine,w/o regard to intellectual property claims we would be best situated to contain the pandemic and quickly respond to the development of new strains."" https://t.co/KBdtpzRWQ1",Twitter Web App,2021-11-30T18:16:36.000Z,0.0,215292073.0,,,,en
1.4657465930139116e+18,"Do you feel the push back coming Joe or are you too sleepy to see it!

@WestJournalism https://t.co/zvrKfHvWEh",Twitter Web App,2021-11-30T18:16:34.000Z,0.0,1.2708241942430474e+18,Person,Joe,,en
1.4657465561377464e+18,"With overall death rate declining prior to vaccine roll out, why the claim of an emergency, lockdowns and masking of the perfectly healthy, and coerced mRNA injections and passports? No sign of ethical evidence-based medicine, so what is it? @BLNewsMedia @DrP_MD @TheoFleury14 https://t.co/GNaPF49P2J",Twitter for iPhone,2021-11-30T18:16:25.000Z,0.0,1.358169839010009e+18,,,,en
1.4657465519852913e+18,So many lives lost because people are denied protection from COVID. So many lives lost because of Europe's complicity with Big Pharma's greedy shareholders who refuse to share lifesaving vaccine technology with the world. #noprofitonpandemic #TRIPSWaivernow https://t.co/4aSSwrpoCI,Twitter for Android,2021-11-30T18:16:24.000Z,0.0,43068354.0,Place Organization,Europe Big Pharma,noprofitonpandemic TRIPSWaivernow,en
1.4657465403126047e+18,"The vaccine, called Aspenovax, will be manufactured from drug substance supplied by Johnson &amp; Johnson and sold to public sector markets in Africa. https://t.co/xeqNd5naug",Echobox,2021-11-30T18:16:22.000Z,0.0,17990267.0,Organization Person Person Place,Aspenovax Johnson Johnson Africa,,en
1.465746534759383e+18,I understand the vaccine is available.  Many just have chosen not to take it.       Did vaccine inequality lead to emergence of Omicron variant? | The Times of Israel https://t.co/f3llHFqa1X,Twitter for iPhone,2021-11-30T18:16:20.000Z,0.0,82453530.0,Organization,The Times of Israel,,en
1.4657465344070205e+18,I would like to suggest that vaccine passports be required to enter any hospital for any reason.,Twitter for Android,2021-11-30T18:16:20.000Z,0.0,29879406.0,,,,en
1.4657465299526697e+18,Here is a question. A returning Zimbabwean resident vaccinated in Zimbabwe with a negative PCR test has to quarantine?. What does that say about the vaccine? https://t.co/hSI7f4mqfc,Twitter for iPhone,2021-11-30T18:16:19.000Z,0.0,352944411.0,Place,Zimbabwe,,en
1.465746527381504e+18,"Unvaccinated? 
Starting today you won’t be able to board a plane, train in Canada https://t.co/UFXFv68R9K",Twitter Web App,2021-11-30T18:16:19.000Z,0.0,2491664966.0,Place,Canada,,en
1.465746524038742e+18,"Mull. Sadly the whole island sleeping into the #vaccine genocide &amp; new world order. Still, always persist in leaving info with people as they may join dots later on #COVID19 #covid1984 #covidvariant #OmriconVariant https://t.co/7FQnorJgIl",Twitter for iPhone,2021-11-30T18:16:18.000Z,0.0,1.4403675014313042e+18,,,vaccine COVID19 covid1984 covidvariant OmriconVariant,en
1.465746511233532e+18,German doctor administered his own homemade vaccine to 20K people https://t.co/8i5Q4Qk42J via @Yahoo,Twitter Web App,2021-11-30T18:16:15.000Z,0.0,722982356.0,,,,en
1.465746501548667e+18,"Nice synopsis on the ""wait and see"" stance of some employers on the outcome of litigation over the Biden Administration's OSHA vaccine rule https://t.co/Tqy46Nir3t",LinkedIn,2021-11-30T18:16:12.000Z,0.0,2221727533.0,Organization,Biden Administration,,en
1.465746485836927e+18,https://t.co/oWzQV8Iv2y Not sure why tv scientists ignore vaccine induced virus evolution.This has been known for decades from flu already.  https://t.co/IKppbg6h1J #ongevaccineerden #vaccine #Vaccination #unvaccinated #omicron #OmicronVarient,Twitter for iPhone,2021-11-30T18:16:09.000Z,0.0,7.69658951671681e+17,,,ongevaccineerden vaccine Vaccination unvaccinated omicron OmicronVarient,en
1.4657464849604116e+18,I just heard one of my biggest clients is being rushed off to hospital with two bloodclots in his lungs he has had the #COVID19 #Vaccine ...I feel very sorry for his family....his wife just heard she is pregnant again..he is young and was very healthy! People wake up! #Clotshot,Twitter for Android,2021-11-30T18:16:08.000Z,0.0,1.255461334747136e+18,,,COVID19 Vaccine Clotshot,en
1.4657464825402614e+18,AHA is the American Heart Association what the fuck are they gon know about a vaccine?!?!?!? 😂😂😂😭😭😭,Twitter for iPhone,2021-11-30T18:16:08.000Z,0.0,7.558789942228664e+17,Organization,American Heart Association,,en
1.4657464638797455e+18,If you’re “vaccine-hesitant” you’re an idiot. The science is there and the shit is safe. If you die because you aren’t vaccinated I have 0 sympathy for you.,Twitter for iPhone,2021-11-30T18:16:03.000Z,0.0,1.3343012495802614e+18,,,,en
1.465746463150035e+18,"Cruel as this may sound, I'm having a hard time cringing at the internet trolls now going after noisy right-wingers who propagandized against the coronavirus vaccine and then succumbed to the deadly disease. https://t.co/AV45TCMjgu",SocialNewsDesk,2021-11-30T18:16:03.000Z,0.0,18945939.0,,,,en
1.465746462323712e+18,“Vaccines required? Doctors debate if governments should force healthcare workers to get the COVID vaccine” https://t.co/aTXNYdFOaD https://t.co/sTGS0G0c1W,Buffer,2021-11-30T18:16:03.000Z,0.0,9.656554967901962e+17,,,,en
1.4657464519847485e+18,"French Govts plan 2 Impose Vaccine Mandates In Caribbean nations Martinique &amp; Guadeloupe backfires following massive protests &amp; riots, forcing mandate to stop. 
Never forget power of people is greater than people in power, it just needs used correctly. https://t.co/wmQrHDHzeZ",Twitter for iPhone,2021-11-30T18:16:01.000Z,0.0,1.363890809418965e+18,Place Place,Caribbean Martinique & Guadeloupe,,en
1.465746411237032e+18,"China's Xi pledges another 1bn Covid-19 vaccine doses for Africa

Follow our updates on #coronavirus here: https://t.co/vY4fVgAjuk",TweetDeck,2021-11-30T18:15:51.000Z,0.0,249022032.0,Place Place,China Africa,coronavirus,en
1.465746408384852e+18,"A lot of anti-maskers and anti-vaxers see the covid cases and deaths from it coming down and say we don’t need the vaccines or the masks. Wrong! It’s thanks to those of us who got the vaccines that it is happening. If they would get vaccine, we could beat this virus!! https://t.co/7ljBtmbAJQ",Twitter for iPhone,2021-11-30T18:15:50.000Z,0.0,1.4605353121955471e+18,,,,en
1.4657464073532006e+18,"Sinovac releases vaccine data in Brazil: 100% effective in preventing severe cases, could reduce hospitalizations by 80% - Global Times https://t.co/joposqhYRb",Twitter for Android,2021-11-30T18:15:50.000Z,0.0,54609348.0,Place,Brazil,,en
1.4657464016237773e+18,Jim Cramer DEMANDS Biden Impose Nationwide Vaccine Mandate //Cramer should be criticizing Republicans &amp; Fox News obstructing vaccine usage NOT Dems &amp; Biden who have encouraged vaccines for all https://t.co/wJFRMPQblH,Tweetbot for iΟS,2021-11-30T18:15:49.000Z,0.0,12599412.0,Person Person Organization Organization Organization Person,Jim Cramer Biden Republicans Fox News Dems Biden,,en
1.4657463981004718e+18,"Italy: ""29K deaths and 4.3M infections averted (with respect to a baseline without vaccine but same NPIs)"", for Greece a similar work estimated ~8400 deaths averted over 10 months https://t.co/M1yRq8ib8C",Twitter Web App,2021-11-30T18:15:48.000Z,0.0,14250071.0,Place Place,Italy Greece,,en
1.4657463897747825e+18,"Forbes wrote an article today titled ""Yes, the vaccines change your DNA. A tiny bit. That's a good thing"". Then changed the title to cover up what they initially posted after it started getting shared online. 🤡

Proof 1: https://t.co/9IizTdbv9m 
Proof2:https://t.co/nOAC6AMIPi",Twitter Web App,2021-11-30T18:15:46.000Z,0.0,1.4638295129244099e+18,Organization,Forbes,,en
1.4657463686396846e+18,🚨🚨 EUROPEAN MARKETS FLIP THEIR F*CK OVER VACCINE EFFICACY CONCERNS; CRASHES 🚨🚨 https://t.co/f7guoJTDxA,Twitter for iPhone,2021-11-30T18:15:41.000Z,0.0,69082119.0,,,,en
1.465746367045718e+18,"Omicron COVID-19 variant is coming, Ventura County health officer warns https://t.co/hxxpzTNz63 via @vcstar 

I hope we have a contingency plan based on more than just the movie pandemic, and “closing the bars…”.",Twitter for iPhone,2021-11-30T18:15:40.000Z,1.0,2995002674.0,Place,Ventura County,,en
1.4657463439143117e+18,"We Ran OSHA. Here's the Truth About the So-Called 'Vaccine Mandate'
https://t.co/m4DaKmjgOR",Sprinklr,2021-11-30T18:15:35.000Z,0.0,386742828.0,,,,en
1.4657463393298924e+18,"It really pisses me off how stupid people are I brought up that Travis Scott basically murdered those kids at his concert and some guy goes “your probably an anti vaccer too?” What? How is that related Lol Im anti big Pharma, get a vaccine who cares. I just actually process info",Twitter for iPhone,2021-11-30T18:15:34.000Z,0.0,40749295.0,Person,Travis Scott,,en
1.4657463361631846e+18,So y’all think the vaccine they forced us to get is working or nah? 👀,Twitter for iPhone,2021-11-30T18:15:33.000Z,0.0,308490163.0,,,,en
1.465746327518724e+18,"""We know that the so-called Remainers, not all of them but many of them, are from the elites""

This is always where my eyes glaze over: how can you say that most of 48% of voters in 2016 were ""from the elites""? Most I knew were broke-arsed uni grads. https://t.co/zG150XEX3L",Twitter Web App,2021-11-30T18:15:31.000Z,0.0,54368522.0,,,,en
1.4657463181403505e+18,The life and tragic death of John Eyers – a fitness fanatic who refused the vaccine | Vaccines and immunisation | The Guardian https://t.co/d52TvOU5du,Twitter for iPhone,2021-11-30T18:15:29.000Z,0.0,20388800.0,Person Organization,John Eyers The Guardian,,en
1.4657463170917376e+18,"I remember when this Captain America line used to be a left leaning position. Now look at them... worshiping Fauci, making songs about vaccine mandates, threatening to loot and pillage if they don't get their way... You are not ""#RESIST"" anymore. You are the status quo. https://t.co/N9F3ywDCyj",Twitter Web App,2021-11-30T18:15:28.000Z,0.0,2826786629.0,Person,Captain America,RESIST,en
1.4657462964222075e+18,Rwanda Joins Few African Nations Offering Covid Vaccine Boosters #DigitalHealth #digital #health via https://t.co/5oYb0tyrsS https://t.co/ewO6HHhdIb,TwinyBots,2021-11-30T18:15:23.000Z,0.0,1.43925925693986e+18,Place,Rwanda,DigitalHealth digital health,en
1.465746287186305e+18,"CPT Coding with Administration Coding Example:
((https://t.co/6FpVv9Tqlh))

.
#nixxemedical #medicalillingsolution #medicalcoding #medicalbilling #medicalcoders #medicalcodingandbilling",Twitter Web App,2021-11-30T18:15:21.000Z,0.0,1.455150108836864e+18,,,nixxemedical medicalillingsolution medicalcoding medicalbilling medicalcoders medicalcodingandbilling,en
1.4657462848669082e+18,"»Pfizer CEO Albert Bourla said yesterday that if a new vaccine is required to provide immunity to the Omicron variant, it could take up to 100 days to get the vaccine tested and into production.« 
https://t.co/4cFFekjGjE https://t.co/bZFo6wFDtf",Twitter Web App,2021-11-30T18:15:21.000Z,0.0,46989095.0,Organization Person Organization,Pfizer Albert Bourla Omicron,,en
1.4657462832352707e+18,https://t.co/gGoY5ZRpr4 One of the adverse effects of the Covid vaccine is severe mental issues.,Twitter for Android,2021-11-30T18:15:20.000Z,0.0,22364018.0,,,,en
1.465746275983315e+18,"I'm sure this ""journalist"" caught a sh*t storm from his corporate media bosses, pharmas, and the Biden Admin. So, he changed the title of the article 🤣. The original said ""the vaccine does change your DNA"" https://t.co/qL6U4caLZz",Twitter Web App,2021-11-30T18:15:19.000Z,0.0,1.2201318554642678e+18,Person,Biden Admin,,en
1.4657462747880243e+18,"HPV Vaccine Is Reducing Cervical Cancers in Teens, Young Women | Health News https://t.co/vsaIKfpbqP",WordPress.com,2021-11-30T18:15:18.000Z,0.0,9.494346830283981e+17,,,,en
