,text,sentiment,labels,ca_related
228,"- Hey guys it's a new variant
- Hey guys it's showing symptoms that match vaccine side effects- Hey guys it can infect the fully vaxxed which never happened before now https://t.co/2KkYZ7i63g https://t.co/cqNhH2fMeJ",neg,vax-efficiency,na
229,"1) ❗️Second federal judge deals hammer blow to Biden vax mandate - orders healthcare workers nationwide injunction
A federal judge in the State of Louisiana blocked President Biden’s vaccine mandate for health care workers Tuesday issuing a nationwide injunction. (Reuters)",neg,pandemic-legal,na
230,"Utterly unbelievable!
Sale of UK vaccine centre smacks of short memory syndrome https://t.co/laPNWvuaIa",neg,vax-efficiency,non-ca
231,"The real conspiracy theorists believe with each covid variant needs new vaccines and boosters,masks and social distancing,isolation,proof of QR code check-in and or proof of vaccine status.They also believe they are immune from contracting or spreading the variants.",neg,covid-controversy,na
232,"When you have a governor like @GovMurphy making decisions about forcing people to get the vaccine, it’s a violation of the constitution. People should not be forced to get a vaccine. It’s their body and their choice.",neg,pandemic-legal,na
233,I wish I had the mental acuity at day 628 of the apocalypse to express this feeling succinctly but I continue to be deeply troubled that Americans are normalizing boosters and the IP of the vaccine which much of the world has little access to remains proprietary,neg,pandemic-logistics,na
234,The vaccine rollout made it crystal clear COVID is staying permanently.,neg,vax-efficiency,na
235,What I don't understand is we know that vaccinated people can get and spread covid? Why mandate a vaccine that has potentially life threatening side effects and is not FDA approved. No accountability? https://t.co/pfjW01w2Kp,neg,covid-controversy,na
236,"So the whole fam has covid, the sickest ones are the ones with the vaccine… make it make sense",neg,covid-controversy,na
237,"And this wise guy is pushing vaccine for  kids. Survival rate from the virus is bigger than the vaccine!
They Wana make a trial with the vaccine on your kids!!!!Do not comply!!!!!!!!! https://t.co/NmWnjBsZqq",neg,covid-controversy,na
238,"read a paper this morning that not only does the covid vaccine not cause male fertility problems, sperm count was higher 70 days after the second dose, great news for all you sperm kings and queens out there",neg,vax-efficiency,na
239,"In Sweden, they actually are implanting microchips in peoples hands to convey vaccine status. 😡",neg,covid-controversy,non-ca
240,"You are right my friend , but with the exception of the Mumps vaccine 4 years 10months, the rest took decades to perfect. The present Covid Vaccines took less than a year. So there is no like for like for like here. https://t.co/Ou2YJlOvuy",neg,covid-controversy,na
241,“I am outraged the kids who were killed in that school shooting were forced to wear masks! The vaccine hoax left is ruining our children.” -Faux News Personalities,neg,covid-controversy,na
242,"So the solution will always be take another shot, just one more and you'll be safe....
Bull! We will never be ""safe"" in their eyes because true safety means they'd lose their tyrannical hold on us.https://t.co/ExeGZxPwQ6",neg,covid-controversy,na
243,Absolutely zero possibility I’ll be taking a Covid vaccine booster. I’ve done my part. Double jabbed is enough. I’ll watch and see what happens in the next few years first.,neg,covid-controversy,na
244,Idiots - wake up people- what’s been done isn’t working. It’s time to concentrate on ALL possible Therapeutics… what’s the definition of insanity? Doing the same thing over again expecting different results. Stop believing in a vaccine that clearly doesn’t work https://t.co/yk7Lw0Wt0U,neg,covid-controversy,na
245,"""Allowing new variants to emerge and spread, 13 months into the vaccine era, is a policy choice by the rich world."" https://t.co/SeQdKmCrIH",neg,covid-controversy,na
246,In there opinion the Flaws are-People having heart issues after the vaccine and talking about it. https://t.co/J8b4u8k9Z7,neg,vax-efficiency,na
247,"This doctor was recently beat to death for what he knows and what he published about this so called vaccine. You still want that shot? I sure as hell do not so stop trying to mandate a death sentence on the population. @JoeBiden. 
HeyJoeWeKnow!#NoVaccineMandates #NoMeansNo https://t.co/nHc4zmhihK",neg,pandemic-legal,non-ca
248,"COVID VACCINE EFFICACY/SAFETY DATA ALONE SHOULD BE ENOUGH TO END THESE MANDATES.  DOES NOT STOP TRANSMISSION.  MORE ADVERSE EVENTS IN 6 MONTHS THAN ALL OTHER VACCINES FOR THE LAST 30 YEARS COMBINED.  STILL ""EXPERIMENTAL"".  
CRIMES AGAINST HUMANITY UNFOLDING BEFORE OUR EYES.",neg,covid-controversy,na
249,⁦@RandPaul⁩ ⁦@DonaldJTrumpJr⁩ it’s Shameful that President Trump and now Senator RAND Paul seem to both become a salesman for big Pharma another vaccine what for more mandates more money for big Pharma from the government Fr taxpayer $ #LBG https://t.co/4t6XtuPir2,neg,covid-controversy,non-ca